{
  "schema_version": "alice.coverage_assessment.v1",
  "assessment_id": "778696b2-da24-530b-9acf-9cdbe0c78e45",
  "request_id": "ec39d72b-b8e6-41fa-a95b-630fd0e9d9cc",
  "subject_resolution_id": "7158c6fb-52e3-51a1-b211-f308f293b535",
  "jurisdiction_context_id": "b8ebd68d-59bd-58c2-b8b9-aa8f1ae76e64",
  "request_mode": "batch_compare",
  "effective_county_fips": null,
  "effective_coverage_tier": null,
  "county_registry_mode": "none",
  "local_footing_status": "blocked",
  "capability_assessment": {
    "parcel_identity": {
      "status": "blocked_by_unresolved_jurisdiction",
      "county_registry_level": null,
      "supporting_source_ids": [
        "state_tx_stratmap_land_parcels"
      ],
      "coverage_basis": "unresolved",
      "notes": [
        "County attachment is required before local parcel, zoning, planning, or tax sources can be used safely."
      ]
    },
    "parcel_geometry": {
      "status": "minimal",
      "county_registry_level": null,
      "supporting_source_ids": [
        "state_tx_stratmap_land_parcels"
      ],
      "coverage_basis": "state_source_presence",
      "notes": [
        "Statewide parcel geometry may help later, but county attachment is still missing."
      ]
    },
    "tax_roll": {
      "status": "blocked_by_unresolved_jurisdiction",
      "county_registry_level": null,
      "supporting_source_ids": [],
      "coverage_basis": "unresolved",
      "notes": [
        "County attachment is required before local parcel, zoning, planning, or tax sources can be used safely."
      ]
    },
    "zoning": {
      "status": "blocked_by_unresolved_jurisdiction",
      "county_registry_level": null,
      "supporting_source_ids": [],
      "coverage_basis": "unresolved",
      "notes": [
        "County attachment is required before local parcel, zoning, planning, or tax sources can be used safely."
      ]
    },
    "planning_docs": {
      "status": "blocked_by_unresolved_jurisdiction",
      "county_registry_level": null,
      "supporting_source_ids": [],
      "coverage_basis": "unresolved",
      "notes": [
        "County attachment is required before local parcel, zoning, planning, or tax sources can be used safely."
      ]
    },
    "environmental_baseline": {
      "status": "minimal",
      "county_registry_level": null,
      "supporting_source_ids": [
        "federal_epa_ejscreen",
        "federal_fema_nfhl",
        "federal_usda_soil_data_access",
        "federal_usfws_nwi",
        "federal_usgs_3dep_elevation"
      ],
      "coverage_basis": "federal_baseline",
      "notes": [
        "Only national baseline overlays are currently attachable."
      ]
    },
    "water_signals": {
      "status": "minimal",
      "county_registry_level": null,
      "supporting_source_ids": [
        "federal_usda_soil_data_access"
      ],
      "coverage_basis": "federal_baseline",
      "notes": [
        "Current water or agriculture footing is directional and mostly baseline-level."
      ]
    },
    "utilities": {
      "status": "minimal",
      "county_registry_level": null,
      "supporting_source_ids": [
        "federal_fcc_bdc_national",
        "state_tx_puc_electricity_maps"
      ],
      "coverage_basis": "state_source_presence",
      "notes": [
        "State-level infrastructure sources are available, but local feasibility remains directional."
      ]
    },
    "transmission": {
      "status": "minimal",
      "county_registry_level": null,
      "supporting_source_ids": [
        "state_tx_puc_electricity_maps"
      ],
      "coverage_basis": "state_source_presence",
      "notes": [
        "State-level infrastructure sources are available, but local feasibility remains directional."
      ]
    },
    "market_context": {
      "status": "partial",
      "county_registry_level": null,
      "supporting_source_ids": [
        "listing_platform_land_com",
        "listing_platform_redfin",
        "listing_platform_zillow"
      ],
      "coverage_basis": "listing_platform",
      "notes": [
        "Listing inputs already provide a directional market context entry point."
      ]
    }
  },
  "critical_surfaces": [
    "market_context",
    "parcel_identity",
    "parcel_geometry",
    "tax_roll",
    "environmental_baseline",
    "utilities",
    "transmission"
  ],
  "missing_surfaces": [
    "parcel_identity",
    "tax_roll"
  ],
  "source_summary": {
    "relevant_source_count": 11,
    "relevant_source_ids": [
      "federal_epa_ejscreen",
      "federal_fcc_bdc_national",
      "federal_fema_nfhl",
      "federal_usda_soil_data_access",
      "federal_usfws_nwi",
      "federal_usgs_3dep_elevation",
      "listing_platform_land_com",
      "listing_platform_redfin",
      "listing_platform_zillow",
      "state_tx_puc_electricity_maps",
      "state_tx_stratmap_land_parcels"
    ],
    "preferred_source_ids": [],
    "federal_source_ids": [
      "federal_epa_ejscreen",
      "federal_fcc_bdc_national",
      "federal_fema_nfhl",
      "federal_usda_soil_data_access",
      "federal_usfws_nwi",
      "federal_usgs_3dep_elevation"
    ],
    "state_source_ids": [
      "state_tx_puc_electricity_maps",
      "state_tx_stratmap_land_parcels"
    ],
    "county_source_ids": [],
    "local_source_ids": [],
    "listing_platform_source_ids": [
      "listing_platform_land_com",
      "listing_platform_redfin",
      "listing_platform_zillow"
    ],
    "official_source_count": 8,
    "only_federal_baseline_available": false
  },
  "constraints_on_next_steps": [
    {
      "constraint_type": "state_only_research_footing",
      "message": "Only state-level geography is attached, so local parcel, zoning, and tax surfaces remain blocked."
    },
    {
      "constraint_type": "listing_not_parcel_confirmed",
      "message": "Listing inputs still need parcel confirmation before parcel-level conclusions are safe."
    },
    {
      "constraint_type": "batch_mixed_jurisdiction_certainty",
      "message": "Active batch subjects do not yet share one stable county attachment."
    }
  ],
  "suitability_for_deep_research": "not_ready",
  "notes": [],
  "generated_at": "2026-04-16T22:48:10.016072Z"
}
