{
  "schema_version": "alice.coverage_assessment.v1",
  "assessment_id": "926c4e1b-87b5-5063-992b-43348ae63c5d",
  "request_id": "c11d9f9e-9a66-4d95-8f73-f0bb6eebf7c1",
  "subject_resolution_id": "8f85853f-3f8c-58f4-9e6c-4fb53a6d8f4d",
  "jurisdiction_context_id": "93f8fa68-e701-5042-8392-140c7f88d199",
  "request_mode": "follow_up",
  "effective_county_fips": "48229",
  "effective_coverage_tier": "partial",
  "county_registry_mode": "curated_override",
  "local_footing_status": "partial_local_footing",
  "capability_assessment": {
    "parcel_identity": {
      "status": "available",
      "county_registry_level": "full",
      "supporting_source_ids": [
        "county_tx_hudspeth_cad_property_search",
        "county_tx_hudspeth_cad_public_information",
        "state_tx_stratmap_land_parcels"
      ],
      "coverage_basis": "county_registry",
      "notes": []
    },
    "parcel_geometry": {
      "status": "partial",
      "county_registry_level": null,
      "supporting_source_ids": [
        "state_tx_stratmap_land_parcels"
      ],
      "coverage_basis": "state_source_presence",
      "notes": []
    },
    "tax_roll": {
      "status": "available",
      "county_registry_level": "full",
      "supporting_source_ids": [
        "county_tx_hudspeth_cad_property_search",
        "county_tx_hudspeth_cad_public_information"
      ],
      "coverage_basis": "county_registry",
      "notes": []
    },
    "zoning": {
      "status": "unavailable",
      "county_registry_level": "none",
      "supporting_source_ids": [],
      "coverage_basis": "county_registry",
      "notes": [
        "County registry does not currently provide strong footing for this local surface."
      ]
    },
    "planning_docs": {
      "status": "partial",
      "county_registry_level": "partial",
      "supporting_source_ids": [
        "county_tx_hudspeth_forms_and_applications"
      ],
      "coverage_basis": "county_registry",
      "notes": []
    },
    "environmental_baseline": {
      "status": "partial",
      "county_registry_level": "partial",
      "supporting_source_ids": [
        "federal_epa_ejscreen",
        "federal_fema_nfhl",
        "federal_usda_soil_data_access",
        "federal_usfws_nwi",
        "federal_usgs_3dep_elevation"
      ],
      "coverage_basis": "county_registry",
      "notes": [
        "Environmental baseline uses federal overlays even when county-local depth is thin."
      ]
    },
    "water_signals": {
      "status": "minimal",
      "county_registry_level": "none",
      "supporting_source_ids": [
        "federal_usda_soil_data_access"
      ],
      "coverage_basis": "federal_baseline",
      "notes": [
        "Current water or agriculture footing is directional and mostly baseline-level."
      ]
    },
    "utilities": {
      "status": "partial",
      "county_registry_level": "partial",
      "supporting_source_ids": [
        "federal_fcc_bdc_national",
        "state_tx_puc_electricity_maps"
      ],
      "coverage_basis": "county_registry",
      "notes": []
    },
    "transmission": {
      "status": "partial",
      "county_registry_level": "partial",
      "supporting_source_ids": [
        "state_tx_puc_electricity_maps"
      ],
      "coverage_basis": "county_registry",
      "notes": []
    },
    "market_context": {
      "status": "unavailable",
      "county_registry_level": "none",
      "supporting_source_ids": [],
      "coverage_basis": "unresolved",
      "notes": []
    }
  },
  "critical_surfaces": [
    "parcel_identity",
    "parcel_geometry",
    "tax_roll",
    "zoning",
    "planning_docs",
    "environmental_baseline",
    "utilities",
    "transmission"
  ],
  "missing_surfaces": [
    "zoning"
  ],
  "source_summary": {
    "relevant_source_count": 11,
    "relevant_source_ids": [
      "county_tx_hudspeth_cad_property_search",
      "county_tx_hudspeth_cad_public_information",
      "county_tx_hudspeth_forms_and_applications",
      "federal_epa_ejscreen",
      "federal_fcc_bdc_national",
      "federal_fema_nfhl",
      "federal_usda_soil_data_access",
      "federal_usfws_nwi",
      "federal_usgs_3dep_elevation",
      "state_tx_puc_electricity_maps",
      "state_tx_stratmap_land_parcels"
    ],
    "preferred_source_ids": [
      "county_tx_hudspeth_cad_property_search",
      "county_tx_hudspeth_cad_public_information",
      "state_tx_stratmap_land_parcels",
      "state_tx_puc_electricity_maps",
      "federal_fema_nfhl",
      "federal_usfws_nwi",
      "federal_usda_soil_data_access",
      "federal_usgs_3dep_elevation",
      "federal_fcc_bdc_national",
      "federal_epa_ejscreen"
    ],
    "federal_source_ids": [
      "federal_epa_ejscreen",
      "federal_fcc_bdc_national",
      "federal_fema_nfhl",
      "federal_usda_soil_data_access",
      "federal_usfws_nwi",
      "federal_usgs_3dep_elevation"
    ],
    "state_source_ids": [
      "state_tx_puc_electricity_maps",
      "state_tx_stratmap_land_parcels"
    ],
    "county_source_ids": [
      "county_tx_hudspeth_cad_property_search",
      "county_tx_hudspeth_cad_public_information",
      "county_tx_hudspeth_forms_and_applications"
    ],
    "local_source_ids": [],
    "listing_platform_source_ids": [],
    "official_source_count": 11,
    "only_federal_baseline_available": false
  },
  "constraints_on_next_steps": [
    {
      "constraint_type": "local_zoning_missing",
      "message": "Local zoning visibility is still weak or absent for this county."
    }
  ],
  "suitability_for_deep_research": "partially_ready",
  "notes": [
    "Parcel identity and tax context are stronger than zoning visibility in Hudspeth County.",
    "County-level forms provide procedural clues, but parcel-specific development feasibility still requires local confirmation.",
    "Water-rights and utility feasibility remain unresolved without deeper state or local follow-up."
  ],
  "generated_at": "2026-04-17T08:17:32.858245Z"
}