{
  "schema_version": "alice.coverage_assessment.v1",
  "assessment_id": "676473eb-14e2-533b-950b-844a53aaf04b",
  "request_id": "5c79f5db-53a2-4c49-b50a-8777d7dc1af1",
  "subject_resolution_id": "c29d05e0-3bd5-503a-8455-d3ddff38f082",
  "jurisdiction_context_id": "4784ad6b-97a1-53be-8fb2-16df6bbae9e1",
  "request_mode": "deep_research",
  "effective_county_fips": "06029",
  "effective_coverage_tier": "full",
  "county_registry_mode": "curated_override",
  "local_footing_status": "strong_local_footing",
  "capability_assessment": {
    "parcel_identity": {
      "status": "available",
      "county_registry_level": "full",
      "supporting_source_ids": [
        "county_ca_kern_interactive_mapping",
        "county_ca_kern_parcelquest_property_search"
      ],
      "coverage_basis": "county_registry",
      "notes": []
    },
    "parcel_geometry": {
      "status": "available",
      "county_registry_level": null,
      "supporting_source_ids": [
        "county_ca_kern_gis_data",
        "county_ca_kern_interactive_mapping"
      ],
      "coverage_basis": "county_registry",
      "notes": []
    },
    "tax_roll": {
      "status": "available",
      "county_registry_level": "full",
      "supporting_source_ids": [
        "county_ca_kern_parcelquest_property_search"
      ],
      "coverage_basis": "county_registry",
      "notes": []
    },
    "zoning": {
      "status": "available",
      "county_registry_level": "full",
      "supporting_source_ids": [
        "county_ca_kern_interactive_mapping"
      ],
      "coverage_basis": "county_registry",
      "notes": []
    },
    "planning_docs": {
      "status": "partial",
      "county_registry_level": "partial",
      "supporting_source_ids": [
        "county_ca_kern_interactive_mapping",
        "local_ca_bakersfield_planning"
      ],
      "coverage_basis": "county_registry",
      "notes": []
    },
    "environmental_baseline": {
      "status": "partial",
      "county_registry_level": "partial",
      "supporting_source_ids": [
        "federal_epa_ejscreen",
        "federal_fema_nfhl",
        "federal_usda_soil_data_access",
        "federal_usfws_nwi",
        "federal_usgs_3dep_elevation"
      ],
      "coverage_basis": "county_registry",
      "notes": [
        "Environmental baseline uses federal overlays even when county-local depth is thin."
      ]
    },
    "water_signals": {
      "status": "minimal",
      "county_registry_level": "minimal",
      "supporting_source_ids": [
        "federal_usda_soil_data_access"
      ],
      "coverage_basis": "county_registry",
      "notes": []
    },
    "utilities": {
      "status": "partial",
      "county_registry_level": "partial",
      "supporting_source_ids": [
        "federal_fcc_bdc_national"
      ],
      "coverage_basis": "county_registry",
      "notes": []
    },
    "transmission": {
      "status": "partial",
      "county_registry_level": "partial",
      "supporting_source_ids": [
        "state_ca_energy_commission_transmission"
      ],
      "coverage_basis": "county_registry",
      "notes": []
    },
    "market_context": {
      "status": "partial",
      "county_registry_level": "none",
      "supporting_source_ids": [
        "listing_platform_land_com"
      ],
      "coverage_basis": "listing_platform",
      "notes": [
        "Listing inputs already provide a directional market context entry point."
      ]
    }
  },
  "critical_surfaces": [
    "parcel_identity",
    "parcel_geometry",
    "tax_roll",
    "zoning",
    "planning_docs",
    "environmental_baseline",
    "utilities",
    "transmission",
    "market_context"
  ],
  "missing_surfaces": [],
  "source_summary": {
    "relevant_source_count": 12,
    "relevant_source_ids": [
      "county_ca_kern_gis_data",
      "county_ca_kern_interactive_mapping",
      "county_ca_kern_parcelquest_property_search",
      "federal_epa_ejscreen",
      "federal_fcc_bdc_national",
      "federal_fema_nfhl",
      "federal_usda_soil_data_access",
      "federal_usfws_nwi",
      "federal_usgs_3dep_elevation",
      "listing_platform_land_com",
      "local_ca_bakersfield_planning",
      "state_ca_energy_commission_transmission"
    ],
    "preferred_source_ids": [
      "county_ca_kern_parcelquest_property_search",
      "county_ca_kern_interactive_mapping",
      "county_ca_kern_gis_data",
      "state_ca_energy_commission_transmission",
      "federal_fema_nfhl",
      "federal_usfws_nwi",
      "federal_usda_soil_data_access",
      "federal_usgs_3dep_elevation",
      "federal_fcc_bdc_national",
      "federal_epa_ejscreen"
    ],
    "federal_source_ids": [
      "federal_epa_ejscreen",
      "federal_fcc_bdc_national",
      "federal_fema_nfhl",
      "federal_usda_soil_data_access",
      "federal_usfws_nwi",
      "federal_usgs_3dep_elevation"
    ],
    "state_source_ids": [
      "state_ca_energy_commission_transmission"
    ],
    "county_source_ids": [
      "county_ca_kern_gis_data",
      "county_ca_kern_interactive_mapping",
      "county_ca_kern_parcelquest_property_search"
    ],
    "local_source_ids": [
      "local_ca_bakersfield_planning"
    ],
    "listing_platform_source_ids": [
      "listing_platform_land_com"
    ],
    "official_source_count": 11,
    "only_federal_baseline_available": false
  },
  "constraints_on_next_steps": [
    {
      "constraint_type": "listing_not_parcel_confirmed",
      "message": "Listing inputs still need parcel confirmation before parcel-level conclusions are safe."
    }
  ],
  "suitability_for_deep_research": "deep_research_ready",
  "notes": [
    "County parcel and assessor coverage is strong, but planning-code interpretation still requires careful parcel-specific review.",
    "Utility service and water availability remain directional unless confirmed with the relevant local provider or district.",
    "Bakersfield local planning sources only apply when the parcel falls within city or city-influenced planning jurisdiction."
  ],
  "generated_at": "2026-04-17T08:17:32.842100Z"
}