{
  "schema_version": "alice.coverage_assessment.v1",
  "assessment_id": "2d8a38ce-b5d2-5977-9e86-30772cf897fd",
  "request_id": "98df68eb-684b-4bec-b34b-8155a7fa1f39",
  "subject_resolution_id": "0a6f8866-1833-53af-a3be-e639f0fb46a6",
  "jurisdiction_context_id": "3ee368ef-484c-5574-92a6-cd586877303e",
  "request_mode": "deep_research",
  "effective_county_fips": "01001",
  "effective_coverage_tier": "minimal",
  "county_registry_mode": "generated_fallback",
  "local_footing_status": "federal_baseline_only",
  "capability_assessment": {
    "parcel_identity": {
      "status": "unavailable",
      "county_registry_level": "minimal",
      "supporting_source_ids": [],
      "coverage_basis": "county_registry",
      "notes": [
        "County registry suggests capability exists, but no matching registered source was found yet."
      ]
    },
    "parcel_geometry": {
      "status": "unavailable",
      "county_registry_level": null,
      "supporting_source_ids": [],
      "coverage_basis": "unresolved",
      "notes": [
        "No registered parcel geometry source is currently attached to this county."
      ]
    },
    "tax_roll": {
      "status": "unavailable",
      "county_registry_level": "none",
      "supporting_source_ids": [],
      "coverage_basis": "county_registry",
      "notes": [
        "County registry does not currently provide strong footing for this local surface."
      ]
    },
    "zoning": {
      "status": "unavailable",
      "county_registry_level": "none",
      "supporting_source_ids": [],
      "coverage_basis": "county_registry",
      "notes": [
        "County registry does not currently provide strong footing for this local surface."
      ]
    },
    "planning_docs": {
      "status": "unavailable",
      "county_registry_level": "none",
      "supporting_source_ids": [],
      "coverage_basis": "county_registry",
      "notes": [
        "County registry does not currently provide strong footing for this local surface."
      ]
    },
    "environmental_baseline": {
      "status": "partial",
      "county_registry_level": "partial",
      "supporting_source_ids": [
        "federal_epa_ejscreen",
        "federal_fema_nfhl",
        "federal_usda_soil_data_access",
        "federal_usfws_nwi",
        "federal_usgs_3dep_elevation"
      ],
      "coverage_basis": "county_registry",
      "notes": [
        "Environmental baseline uses federal overlays even when county-local depth is thin."
      ]
    },
    "water_signals": {
      "status": "minimal",
      "county_registry_level": "none",
      "supporting_source_ids": [
        "federal_usda_soil_data_access"
      ],
      "coverage_basis": "federal_baseline",
      "notes": [
        "Current water or agriculture footing is directional and mostly baseline-level."
      ]
    },
    "utilities": {
      "status": "partial",
      "county_registry_level": "none",
      "supporting_source_ids": [
        "federal_fcc_bdc_national"
      ],
      "coverage_basis": "state_source_presence",
      "notes": [
        "State-level infrastructure sources are available, but local feasibility remains directional."
      ]
    },
    "transmission": {
      "status": "unavailable",
      "county_registry_level": "none",
      "supporting_source_ids": [],
      "coverage_basis": "unresolved",
      "notes": []
    },
    "market_context": {
      "status": "partial",
      "county_registry_level": "none",
      "supporting_source_ids": [
        "listing_platform_land_com"
      ],
      "coverage_basis": "listing_platform",
      "notes": [
        "Listing inputs already provide a directional market context entry point."
      ]
    }
  },
  "critical_surfaces": [
    "parcel_identity",
    "parcel_geometry",
    "tax_roll",
    "zoning",
    "planning_docs",
    "environmental_baseline",
    "utilities",
    "market_context"
  ],
  "missing_surfaces": [
    "parcel_identity",
    "parcel_geometry",
    "tax_roll",
    "zoning",
    "planning_docs"
  ],
  "source_summary": {
    "relevant_source_count": 7,
    "relevant_source_ids": [
      "federal_epa_ejscreen",
      "federal_fcc_bdc_national",
      "federal_fema_nfhl",
      "federal_usda_soil_data_access",
      "federal_usfws_nwi",
      "federal_usgs_3dep_elevation",
      "listing_platform_land_com"
    ],
    "preferred_source_ids": [
      "federal_fema_nfhl",
      "federal_usfws_nwi",
      "federal_usda_soil_data_access",
      "federal_usgs_3dep_elevation",
      "federal_fcc_bdc_national",
      "federal_epa_ejscreen"
    ],
    "federal_source_ids": [
      "federal_epa_ejscreen",
      "federal_fcc_bdc_national",
      "federal_fema_nfhl",
      "federal_usda_soil_data_access",
      "federal_usfws_nwi",
      "federal_usgs_3dep_elevation"
    ],
    "state_source_ids": [],
    "county_source_ids": [],
    "local_source_ids": [],
    "listing_platform_source_ids": [
      "listing_platform_land_com"
    ],
    "official_source_count": 6,
    "only_federal_baseline_available": true
  },
  "constraints_on_next_steps": [
    {
      "constraint_type": "county_on_fallback_registry",
      "message": "The effective county uses a generated fallback registry entry, so local coverage should be treated as minimal."
    },
    {
      "constraint_type": "federal_baseline_only",
      "message": "Only federal baseline sources are currently attached for this context."
    },
    {
      "constraint_type": "listing_not_parcel_confirmed",
      "message": "Listing inputs still need parcel confirmation before parcel-level conclusions are safe."
    },
    {
      "constraint_type": "local_zoning_missing",
      "message": "Local zoning visibility is still weak or absent for this county."
    }
  ],
  "suitability_for_deep_research": "partially_ready",
  "notes": [
    "Autauga County, Alabama is not yet curated in the Alice county registry; this entry is a generated minimal fallback.",
    "Local parcel, zoning, planning, tax roll, and utility sources have not yet been verified for this county.",
    "Current county coverage depends on national baseline sources until county-specific discovery and curation are added.",
    "Current footing is dominated by federal baseline coverage rather than local parcel or planning visibility."
  ],
  "generated_at": "2026-04-16T22:41:38.438062Z"
}
