{
  "schema_version": "alice.coverage_assessment.v1",
  "assessment_id": "5a24afe4-dd58-5905-920c-617ccc04586a",
  "request_id": "0c54d98f-64e2-4f12-8ae2-4b2947bd4b11",
  "subject_resolution_id": "2874761c-7b54-56ad-afb7-95a2d7e32409",
  "jurisdiction_context_id": "b0f8d1b3-4bf1-5b33-878a-733bcad1e423",
  "request_mode": "deep_research",
  "effective_county_fips": null,
  "effective_coverage_tier": null,
  "county_registry_mode": "none",
  "local_footing_status": "blocked",
  "capability_assessment": {
    "parcel_identity": {
      "status": "blocked_by_unresolved_jurisdiction",
      "county_registry_level": null,
      "supporting_source_ids": [
        "state_tx_stratmap_land_parcels"
      ],
      "coverage_basis": "unresolved",
      "notes": [
        "County attachment is required before local parcel, zoning, planning, or tax sources can be used safely."
      ]
    },
    "parcel_geometry": {
      "status": "minimal",
      "county_registry_level": null,
      "supporting_source_ids": [
        "state_tx_stratmap_land_parcels"
      ],
      "coverage_basis": "state_source_presence",
      "notes": [
        "Statewide parcel geometry may help later, but county attachment is still missing."
      ]
    },
    "tax_roll": {
      "status": "blocked_by_unresolved_jurisdiction",
      "county_registry_level": null,
      "supporting_source_ids": [],
      "coverage_basis": "unresolved",
      "notes": [
        "County attachment is required before local parcel, zoning, planning, or tax sources can be used safely."
      ]
    },
    "zoning": {
      "status": "blocked_by_unresolved_jurisdiction",
      "county_registry_level": null,
      "supporting_source_ids": [],
      "coverage_basis": "unresolved",
      "notes": [
        "County attachment is required before local parcel, zoning, planning, or tax sources can be used safely."
      ]
    },
    "planning_docs": {
      "status": "blocked_by_unresolved_jurisdiction",
      "county_registry_level": null,
      "supporting_source_ids": [],
      "coverage_basis": "unresolved",
      "notes": [
        "County attachment is required before local parcel, zoning, planning, or tax sources can be used safely."
      ]
    },
    "environmental_baseline": {
      "status": "minimal",
      "county_registry_level": null,
      "supporting_source_ids": [
        "federal_epa_ejscreen",
        "federal_fema_nfhl",
        "federal_usda_soil_data_access",
        "federal_usfws_nwi",
        "federal_usgs_3dep_elevation"
      ],
      "coverage_basis": "federal_baseline",
      "notes": [
        "Only national baseline overlays are currently attachable."
      ]
    },
    "water_signals": {
      "status": "minimal",
      "county_registry_level": null,
      "supporting_source_ids": [
        "federal_usda_soil_data_access"
      ],
      "coverage_basis": "federal_baseline",
      "notes": [
        "Current water or agriculture footing is directional and mostly baseline-level."
      ]
    },
    "utilities": {
      "status": "minimal",
      "county_registry_level": null,
      "supporting_source_ids": [
        "federal_fcc_bdc_national",
        "state_tx_puc_electricity_maps"
      ],
      "coverage_basis": "state_source_presence",
      "notes": [
        "State-level infrastructure sources are available, but local feasibility remains directional."
      ]
    },
    "transmission": {
      "status": "minimal",
      "county_registry_level": null,
      "supporting_source_ids": [
        "state_tx_puc_electricity_maps"
      ],
      "coverage_basis": "state_source_presence",
      "notes": [
        "State-level infrastructure sources are available, but local feasibility remains directional."
      ]
    },
    "market_context": {
      "status": "unavailable",
      "county_registry_level": null,
      "supporting_source_ids": [],
      "coverage_basis": "unresolved",
      "notes": []
    }
  },
  "critical_surfaces": [
    "parcel_identity",
    "parcel_geometry",
    "tax_roll",
    "zoning",
    "planning_docs",
    "environmental_baseline",
    "water_signals"
  ],
  "missing_surfaces": [
    "parcel_identity",
    "tax_roll",
    "zoning",
    "planning_docs"
  ],
  "source_summary": {
    "relevant_source_count": 8,
    "relevant_source_ids": [
      "federal_epa_ejscreen",
      "federal_fcc_bdc_national",
      "federal_fema_nfhl",
      "federal_usda_soil_data_access",
      "federal_usfws_nwi",
      "federal_usgs_3dep_elevation",
      "state_tx_puc_electricity_maps",
      "state_tx_stratmap_land_parcels"
    ],
    "preferred_source_ids": [],
    "federal_source_ids": [
      "federal_epa_ejscreen",
      "federal_fcc_bdc_national",
      "federal_fema_nfhl",
      "federal_usda_soil_data_access",
      "federal_usfws_nwi",
      "federal_usgs_3dep_elevation"
    ],
    "state_source_ids": [
      "state_tx_puc_electricity_maps",
      "state_tx_stratmap_land_parcels"
    ],
    "county_source_ids": [],
    "local_source_ids": [],
    "listing_platform_source_ids": [],
    "official_source_count": 8,
    "only_federal_baseline_available": false
  },
  "constraints_on_next_steps": [
    {
      "constraint_type": "state_only_research_footing",
      "message": "Only state-level geography is attached, so local parcel, zoning, and tax surfaces remain blocked."
    }
  ],
  "suitability_for_deep_research": "not_ready",
  "notes": [],
  "generated_at": "2026-04-16T22:43:47.149512Z"
}
